{
  "$schema": "http://json-schema.org/draft-04/schema#",
  "description": "Create Individual Response",
  "type": "object",
  "properties": {
    "userId": {
      "type": "string",
      "description": "Government Gateway ID."
    },
    "password": {
      "type": "string",
      "description": "Government Gateway password."
    },
    "userFullName": {
      "type": "string",
      "description": "Government Gateway user's full name."
    },
    "emailAddress": {
      "type": "string",
      "description": "Government Gateway user's email address."
    },
    "individualDetails": {
      "type": "object",
      "properties": {
        "firstName": {
          "type": "string",
          "description": "Individual's first name."
        },
        "lastName": {
          "type": "string",
          "description": "Individual's last name."
        },
        "dateOfBirth": {
          "type": "string",
          "format": "date",
          "description": "Individual's date of birth."
        },
        "address": {
          "type": "object",
          "properties": {
            "line1": {
              "type": "string",
              "description": "Individual's first line of address."
            },
            "line2": {
              "type": "string",
              "description": "Individual's second line of address."
            },
            "postcode": {
              "type": "string",
              "description": "Individual's postcode."
            }
          },
          "required": [
            "line1",
            "line2",
            "postcode"
          ]
        }
      },
      "required": [
        "firstName",
        "lastName",
        "dateOfBirth",
        "address"
      ]
    },
    "saUtr": {
      "type": "string",
      "description": "Self Assessment UTR."
    },
    "nino": {
      "type": "string",
      "description": "National Insurance number."
    },
    "mtdItId": {
      "type": "string",
      "description": "Making Tax Digital Income Tax ID."
    },
    "eoriNumber": {
      "type": "string",
      "description": "Economic Operator Registration and Identification (EORI) number."
    },
    "vrn": {
      "type": "string",
      "description": "VAT Reference Number."
    },
    "vatRegistrationDate": {
      "type": "string",
      "format": "date",
      "description": "Date of registration for VAT."
    },
    "capitalGainsTaxOnUKPropertyReference": {
      "type": "string",
      "description": "Capital Gains Tax on UK Property reference."
    },
    "plasticPackagingTaxRegistrationNumber": {
      "type": "string",
      "description": "Plastic Packaging Tax registration number."
    }
  },
  "required": [
    "userId",
    "password",
    "userFullName",
    "emailAddress",
    "individualDetails"
  ]
}
