{
  "userId":"945350439195",
  "password":"bLohysg8utsa",
  "userFullName": "Ida Newton",
  "emailAddress": "ida.newton@example.com",
  "individualDetails": {
    "firstName": "Ida",
    "lastName": "Newton",
    "dateOfBirth": "1960-06-01",
    "address": {
      "line1": "45 Springfield Rise",
      "line2": "Glasgow",
      "postcode": "TS1 1PA"
    }
  },
  "saUtr":"1000057161",
  "nino":"PE938808A",
  "mtdItId":"XJIT00000328268",
  "vrn":"666119668",
  "vatRegistrationDate":"2001-11-02",
  "eoriNumber":"GB123456789012",
  "capitalGainsTaxOnUKPropertyReference":"XACGTP123456789",
  "plasticPackagingTaxRegistrationNumber":"XAPPT0001234567"
}
